{
  "schema_version": 1,
  "profile_id": "p-0001",
  "tenant_id": "t1",
  "subject_ref": "cust-0001",
  "source": "customer.manage",
  "layers": ["identity", "facts", "evidence", "snapshots"],
  "generated_at": "2026-01-02T03:04:05Z",
  "derived": { "rebuilt": true, "from": "标准消息正文", "unique_source": false }
}
